{
  "$schema": "http://json-schema.org/draft-07/schema#",
  "$id": "https://openweight.org/schemas/workout-log.schema.json",
  "title": "WorkoutLog",
  "description": "A completed strength training session",
  "type": "object",
  "required": ["date", "exercises"],
  "additionalProperties": true,
  "properties": {
    "date": {
      "title": "Date",
      "description": "When the workout occurred in ISO 8601 format with timezone",
      "type": "string",
      "format": "date-time",
      "examples": ["2024-01-15T09:30:00Z", "2024-01-15T10:00:00+01:00"]
    },
    "name": {
      "title": "Name",
      "description": "User-defined workout name",
      "type": "string",
      "maxLength": 200,
      "examples": ["Push Day", "Week 3 Day 1", "Upper Body A"]
    },
    "notes": {
      "title": "Notes",
      "description": "Free-form notes about the session",
      "type": "string",
      "maxLength": 10000
    },
    "durationSeconds": {
      "title": "Duration (seconds)",
      "description": "Total workout duration in seconds",
      "type": "integer",
      "minimum": 0,
      "examples": [3600, 5400]
    },
    "templateId": {
      "title": "Template ID",
      "description": "Optional reference to the workout template this log was created from. App-defined identifier.",
      "type": "string",
      "maxLength": 200
    },
    "exercises": {
      "title": "Exercises",
      "description": "The exercises performed in this workout",
      "type": "array",
      "minItems": 1,
      "items": {
        "$ref": "#/definitions/ExerciseLog"
      }
    }
  },
  "definitions": {
    "ExerciseLog": {
      "title": "ExerciseLog",
      "description": "A single exercise performed within a workout",
      "type": "object",
      "required": ["exercise", "sets"],
      "additionalProperties": true,
      "properties": {
        "exercise": {
          "$ref": "#/definitions/Exercise"
        },
        "order": {
          "title": "Order",
          "description": "Position in workout (1-indexed). If omitted, array order is used.",
          "type": "integer",
          "minimum": 1
        },
        "notes": {
          "title": "Notes",
          "description": "Notes specific to this exercise",
          "type": "string",
          "maxLength": 5000
        },
        "supersetId": {
          "title": "Superset ID",
          "description": "Groups exercises into supersets. Same ID = same superset. Omit if not in a superset.",
          "type": "integer",
          "minimum": 1
        },
        "sets": {
          "title": "Sets",
          "description": "The sets performed for this exercise",
          "type": "array",
          "minItems": 1,
          "items": {
            "$ref": "#/definitions/SetLog"
          }
        }
      }
    },
    "Exercise": {
      "title": "Exercise",
      "description": "Describes which exercise was performed",
      "type": "object",
      "required": ["name"],
      "additionalProperties": true,
      "properties": {
        "name": {
          "title": "Name",
          "description": "Human-readable exercise name",
          "type": "string",
          "minLength": 1,
          "maxLength": 200,
          "examples": ["Barbell Back Squat", "Bench Press", "Pull-up"]
        },
        "equipment": {
          "title": "Equipment",
          "description": "Equipment used. Recommended values: barbell, dumbbell, kettlebell, cable, machine, bodyweight, ez-bar, trap-bar, smith-machine, resistance-band, suspension",
          "type": "string",
          "maxLength": 50,
          "examples": ["barbell", "dumbbell", "bodyweight"]
        },
        "category": {
          "title": "Category",
          "description": "Body part or category. Recommended values: chest, back, shoulders, arms, legs, core, full-body, olympic, cardio",
          "type": "string",
          "maxLength": 50,
          "examples": ["chest", "back", "legs"]
        },
        "musclesWorked": {
          "title": "Muscles Worked",
          "description": "Specific muscles targeted by this exercise",
          "type": "array",
          "items": {
            "type": "string",
            "maxLength": 50
          },
          "examples": [["pectoralis major", "anterior deltoid", "triceps"]]
        }
      }
    },
    "SetLog": {
      "title": "SetLog",
      "description": "A single set within an exercise",
      "type": "object",
      "additionalProperties": true,
      "allOf": [
        {
          "if": { "required": ["weight"] },
          "then": { "required": ["unit"] }
        },
        {
          "if": { "required": ["distance"] },
          "then": { "required": ["distanceUnit"] }
        },
        {
          "if": { "required": ["targetWeight"] },
          "then": { "required": ["unit"] }
        }
      ],
      "properties": {
        "reps": {
          "title": "Reps",
          "description": "Repetitions completed. Omit for time-only exercises. 0 indicates a failed attempt.",
          "type": "integer",
          "minimum": 0,
          "examples": [5, 8, 12]
        },
        "weight": {
          "title": "Weight",
          "description": "Weight used. Omit for bodyweight exercises.",
          "type": "number",
          "minimum": 0,
          "examples": [100, 60.5, 225]
        },
        "unit": {
          "title": "Unit",
          "description": "Weight unit. Required if weight is provided.",
          "type": "string",
          "enum": ["kg", "lb"]
        },
        "durationSeconds": {
          "title": "Duration (seconds)",
          "description": "Time for timed exercises (planks, carries, holds)",
          "type": "integer",
          "minimum": 0,
          "examples": [60, 30, 45]
        },
        "distance": {
          "title": "Distance",
          "description": "Distance for carries, sled work, or other distance-based exercises",
          "type": "number",
          "minimum": 0,
          "examples": [40, 100, 0.5]
        },
        "distanceUnit": {
          "title": "Distance Unit",
          "description": "Distance unit. Required if distance is provided.",
          "type": "string",
          "enum": ["m", "km", "ft", "mi", "yd"]
        },
        "rpe": {
          "title": "RPE",
          "description": "Rate of Perceived Exertion on 0-10 scale. Decimals allowed (e.g., 7.5).",
          "type": "number",
          "minimum": 0,
          "maximum": 10,
          "examples": [7, 8, 8.5]
        },
        "rir": {
          "title": "RIR",
          "description": "Reps In Reserve (alternative to RPE)",
          "type": "integer",
          "minimum": 0,
          "examples": [2, 3, 1]
        },
        "toFailure": {
          "title": "To Failure",
          "description": "Whether the set was taken to muscular failure",
          "type": "boolean"
        },
        "type": {
          "title": "Type",
          "description": "Set type. Recommended values: working, warmup, dropset, backoff, amrap, cluster, myo, rest-pause, failure. Default assumed: working.",
          "type": "string",
          "maxLength": 50,
          "examples": ["working", "warmup", "dropset"]
        },
        "restSeconds": {
          "title": "Rest (seconds)",
          "description": "Rest taken after this set",
          "type": "integer",
          "minimum": 0,
          "examples": [90, 180, 60]
        },
        "tempo": {
          "title": "Tempo",
          "description": "Tempo notation: eccentric-pause-concentric-pause. Use X for explosive. Example: 3-1-2-0",
          "type": "string",
          "pattern": "^[0-9X]-[0-9X]-[0-9X]-[0-9X]$",
          "examples": ["3-1-2-0", "4-0-1-0", "2-0-X-0"]
        },
        "notes": {
          "title": "Notes",
          "description": "Notes for this specific set",
          "type": "string",
          "maxLength": 1000
        },
        "targetReps": {
          "title": "Target Reps",
          "description": "Prescribed number of reps from a program or template",
          "type": "integer",
          "minimum": 0,
          "examples": [5, 8, 12]
        },
        "targetWeight": {
          "title": "Target Weight",
          "description": "Prescribed weight from a program or template",
          "type": "number",
          "minimum": 0,
          "examples": [100, 60.5, 225]
        },
        "targetRPE": {
          "title": "Target RPE",
          "description": "Prescribed Rate of Perceived Exertion from a program or template (0-10)",
          "type": "number",
          "minimum": 0,
          "maximum": 10,
          "examples": [7, 8, 9]
        }
      }
    }
  }
}
