{
  "date": "2024-01-17T17:30:00Z",
  "name": "Chest & Triceps",
  "durationSeconds": 4800,
  "notes": "Good pump today",
  "exercises": [
    {
      "exercise": {
        "name": "Incline Dumbbell Press",
        "equipment": "dumbbell",
        "category": "chest"
      },
      "sets": [
        { "reps": 12, "weight": 30, "unit": "kg", "rir": 3 },
        { "reps": 10, "weight": 32, "unit": "kg", "rir": 2 },
        { "reps": 10, "weight": 32, "unit": "kg", "rir": 2 },
        { "reps": 8, "weight": 32, "unit": "kg", "rir": 1 }
      ]
    },
    {
      "exercise": {
        "name": "Cable Fly",
        "equipment": "cable",
        "category": "chest"
      },
      "sets": [
        { "reps": 15, "weight": 15, "unit": "kg", "rir": 2 },
        { "reps": 12, "weight": 17.5, "unit": "kg", "rir": 1 },
        { "reps": 12, "weight": 17.5, "unit": "kg", "rir": 1 }
      ]
    },
    {
      "exercise": {
        "name": "Machine Chest Press",
        "equipment": "machine",
        "category": "chest"
      },
      "notes": "Dropset on last set",
      "sets": [
        { "reps": 12, "weight": 60, "unit": "kg", "restSeconds": 90 },
        { "reps": 10, "weight": 70, "unit": "kg", "restSeconds": 90 },
        { "reps": 8, "weight": 80, "unit": "kg", "type": "dropset" },
        { "reps": 10, "weight": 60, "unit": "kg", "type": "dropset" },
        { "reps": 12, "weight": 40, "unit": "kg", "type": "dropset" }
      ]
    },
    {
      "exercise": {
        "name": "Tricep Pushdown",
        "equipment": "cable",
        "category": "arms"
      },
      "sets": [
        { "reps": 15, "weight": 25, "unit": "kg", "rir": 2 },
        { "reps": 12, "weight": 30, "unit": "kg", "rir": 1 },
        { "reps": 12, "weight": 30, "unit": "kg", "rir": 1 }
      ]
    },
    {
      "exercise": {
        "name": "Overhead Tricep Extension",
        "equipment": "dumbbell",
        "category": "arms"
      },
      "sets": [
        { "reps": 12, "weight": 20, "unit": "kg", "rir": 2 },
        { "reps": 10, "weight": 22, "unit": "kg", "rir": 1 },
        { "reps": 10, "weight": 22, "unit": "kg", "toFailure": true }
      ]
    },
    {
      "exercise": {
        "name": "Dips",
        "equipment": "bodyweight",
        "category": "chest"
      },
      "sets": [
        { "reps": 12, "rir": 2 },
        { "reps": 10, "rir": 1 },
        { "reps": 8, "toFailure": true }
      ]
    }
  ]
}
